{
  "$schema": "https://json-schema.org/draft/2020-12/schema",
  "$id": "https://cronflow.dev/schemas/run-event/v9",
  "title": "WOML Run Event v9",
  "description": "Append-only workflow events adding truthful workflow-call ingress for called child runs.",
  "x-status": "workflow-calls-wc2-frozen-correction",
  "x-previousVersion": "https://cronflow.dev/schemas/run-event/v8",
  "x-invariants": [
    "Source-triggered Models v1-v9 continue using their original Run Event v1-v8 contracts.",
    "A called child of any supported model begins with workflow_call ingress and does not manufacture a manual or event trigger.",
    "The workflow-call key is engine metadata and never enters context.trigger.",
    "Every event other than run_started retains the exact Run Event v8 payload contract."
  ],
  "type": "object",
  "additionalProperties": false,
  "required": ["eventSchemaVersion", "eventId", "runId", "sequence", "occurredAt", "type", "data"],
  "properties": {
    "eventSchemaVersion": { "const": 9 },
    "eventId": { "$ref": "https://cronflow.dev/schemas/run-event/v1#/$defs/nonEmptyId" },
    "runId": { "$ref": "https://cronflow.dev/schemas/run-event/v1#/$defs/nonEmptyId" },
    "sequence": { "type": "integer", "minimum": 1 },
    "occurredAt": { "type": "string", "format": "date-time" },
    "type": {
      "enum": [
        "run_started", "step_attempt_started", "step_attempt_succeeded", "step_attempt_failed", "step_retry_scheduled",
        "branch_selected", "parallel_group_started", "parallel_group_completed", "approval_requested",
        "notification_delivery_requested", "notification_delivery_attempt_started", "notification_delivery_succeeded",
        "notification_delivery_failed", "notification_decision_accepted", "notification_message_update_requested",
        "notification_message_update_attempt_started", "notification_message_updated", "notification_message_update_failed",
        "approval_resolved", "operation_started", "operation_succeeded", "operation_failed", "run_succeeded", "run_failed"
      ]
    },
    "data": {}
  },
  "allOf": [
    { "if": { "properties": { "type": { "const": "run_started" } }, "required": ["type"] }, "then": { "properties": { "data": { "$ref": "#/$defs/runStartedData" } } } },
    { "if": { "properties": { "type": { "const": "step_attempt_started" } }, "required": ["type"] }, "then": { "properties": { "data": { "$ref": "https://cronflow.dev/schemas/run-event/v6#/$defs/stepAttemptStartedData" } } } },
    { "if": { "properties": { "type": { "const": "step_attempt_succeeded" } }, "required": ["type"] }, "then": { "properties": { "data": { "$ref": "https://cronflow.dev/schemas/run-event/v6#/$defs/stepAttemptSucceededData" } } } },
    { "if": { "properties": { "type": { "const": "step_attempt_failed" } }, "required": ["type"] }, "then": { "properties": { "data": { "$ref": "https://cronflow.dev/schemas/run-event/v8#/$defs/stepAttemptFailedData" } } } },
    { "if": { "properties": { "type": { "const": "step_retry_scheduled" } }, "required": ["type"] }, "then": { "properties": { "data": { "$ref": "https://cronflow.dev/schemas/run-event/v6#/$defs/stepRetryScheduledData" } } } },
    { "if": { "properties": { "type": { "const": "branch_selected" } }, "required": ["type"] }, "then": { "properties": { "data": { "$ref": "https://cronflow.dev/schemas/run-event/v2#/$defs/branchSelectedData" } } } },
    { "if": { "properties": { "type": { "const": "parallel_group_started" } }, "required": ["type"] }, "then": { "properties": { "data": { "$ref": "https://cronflow.dev/schemas/run-event/v3#/$defs/parallelGroupStartedData" } } } },
    { "if": { "properties": { "type": { "const": "parallel_group_completed" } }, "required": ["type"] }, "then": { "properties": { "data": { "$ref": "https://cronflow.dev/schemas/run-event/v3#/$defs/parallelGroupCompletedData" } } } },
    { "if": { "properties": { "type": { "const": "approval_requested" } }, "required": ["type"] }, "then": { "properties": { "data": { "$ref": "https://cronflow.dev/schemas/run-event/v4#/$defs/approvalRequestedData" } } } },
    { "if": { "properties": { "type": { "const": "notification_delivery_requested" } }, "required": ["type"] }, "then": { "properties": { "data": { "$ref": "https://cronflow.dev/schemas/run-event/v5#/$defs/deliveryRequestedData" } } } },
    { "if": { "properties": { "type": { "const": "notification_delivery_attempt_started" } }, "required": ["type"] }, "then": { "properties": { "data": { "$ref": "https://cronflow.dev/schemas/run-event/v5#/$defs/deliveryAttemptStartedData" } } } },
    { "if": { "properties": { "type": { "const": "notification_delivery_succeeded" } }, "required": ["type"] }, "then": { "properties": { "data": { "$ref": "https://cronflow.dev/schemas/run-event/v5#/$defs/deliverySucceededData" } } } },
    { "if": { "properties": { "type": { "const": "notification_delivery_failed" } }, "required": ["type"] }, "then": { "properties": { "data": { "$ref": "https://cronflow.dev/schemas/run-event/v5#/$defs/deliveryFailedData" } } } },
    { "if": { "properties": { "type": { "const": "notification_decision_accepted" } }, "required": ["type"] }, "then": { "properties": { "data": { "$ref": "https://cronflow.dev/schemas/run-event/v5#/$defs/notificationDecisionAcceptedData" } } } },
    { "if": { "properties": { "type": { "const": "notification_message_update_requested" } }, "required": ["type"] }, "then": { "properties": { "data": { "$ref": "https://cronflow.dev/schemas/run-event/v5#/$defs/messageUpdateRequestedData" } } } },
    { "if": { "properties": { "type": { "const": "notification_message_update_attempt_started" } }, "required": ["type"] }, "then": { "properties": { "data": { "$ref": "https://cronflow.dev/schemas/run-event/v5#/$defs/messageUpdateAttemptStartedData" } } } },
    { "if": { "properties": { "type": { "const": "notification_message_updated" } }, "required": ["type"] }, "then": { "properties": { "data": { "$ref": "https://cronflow.dev/schemas/run-event/v5#/$defs/messageUpdatedData" } } } },
    { "if": { "properties": { "type": { "const": "notification_message_update_failed" } }, "required": ["type"] }, "then": { "properties": { "data": { "$ref": "https://cronflow.dev/schemas/run-event/v5#/$defs/messageUpdateFailedData" } } } },
    { "if": { "properties": { "type": { "const": "approval_resolved" } }, "required": ["type"] }, "then": { "properties": { "data": { "$ref": "https://cronflow.dev/schemas/run-event/v4#/$defs/approvalResolvedData" } } } },
    { "if": { "properties": { "type": { "const": "operation_started" } }, "required": ["type"] }, "then": { "properties": { "data": { "$ref": "https://cronflow.dev/schemas/run-event/v8#/$defs/operationStartedData" } } } },
    { "if": { "properties": { "type": { "const": "operation_succeeded" } }, "required": ["type"] }, "then": { "properties": { "data": { "$ref": "https://cronflow.dev/schemas/run-event/v8#/$defs/operationSucceededData" } } } },
    { "if": { "properties": { "type": { "const": "operation_failed" } }, "required": ["type"] }, "then": { "properties": { "data": { "$ref": "https://cronflow.dev/schemas/run-event/v8#/$defs/operationFailedData" } } } },
    { "if": { "properties": { "type": { "const": "run_succeeded" } }, "required": ["type"] }, "then": { "properties": { "data": { "$ref": "https://cronflow.dev/schemas/run-event/v1#/$defs/runSucceededData" } } } },
    { "if": { "properties": { "type": { "const": "run_failed" } }, "required": ["type"] }, "then": { "properties": { "data": { "$ref": "https://cronflow.dev/schemas/run-event/v8#/$defs/runFailedData" } } } }
  ],
  "$defs": {
    "runStartedData": {
      "type": "object",
      "additionalProperties": false,
      "required": ["workflowId", "definitionHash", "ingress", "trigger"],
      "properties": {
        "workflowId": { "$ref": "https://cronflow.dev/schemas/run-event/v1#/$defs/nonEmptyId" },
        "definitionHash": { "$ref": "https://cronflow.dev/schemas/run-event/v1#/$defs/definitionHash" },
        "ingress": {
          "type": "object",
          "additionalProperties": false,
          "required": ["kind", "callKey"],
          "properties": {
            "kind": { "const": "workflow_call" },
            "callKey": { "type": "string", "pattern": "^sha256:[a-f0-9]{64}$" }
          }
        },
        "trigger": { "type": "object" }
      }
    }
  }
}
